{
  "schema_version": "aurekai.capabilities.v1",
  "runtime": {
    "name": "Aurekai Native Runtime",
    "cli": "akai",
    "binary_prefix": "akai-",
    "native_prefix": "Akai",
    "release": "0.8.0-alpha.4"
  },
  "families": [
    {
      "id": "runtime",
      "label": "Aurekai Runtime",
      "description": "Execution, routing, queue management, workflow dispatch, and release gating.",
      "commands": [
        "runtime.capabilities",
        "api.status",
        "control.route",
        "queue.enqueue",
        "queue.stats",
        "queue.work",
        "tier.route",
        "workflow.run",
        "stitch.plan",
        "watch.path",
        "doctor.deep",
        "manifest.verify",
        "runtime.dispatch",
        "release.gate"
      ]
    },
    {
      "id": "commerce",
      "label": "Aurekai Commerce",
      "description": "Auth, gate issuance, metering, invoicing, ledger, CMS, and client outreach.",
      "commands": [
        "auth.verify",
        "gate.issue",
        "gate.guard",
        "meter.record",
        "usage.report",
        "ledger.export",
        "finance.margin",
        "pay.invoice",
        "invoice.generate",
        "outreach.followup",
        "cms.entry.create",
        "project.create"
      ]
    },
    {
      "id": "intake",
      "label": "Aurekai Intake",
      "description": "File ingest, intake resolution, media normalization, transcription, cleaning, segmentation, frame extraction, video demux, and speech loop.",
      "commands": [
        "intake.resolve",
        "ingest.file",
        "media_prep.normalize",
        "transcribe.audio",
        "transcript.clean",
        "segment.speakers",
        "paragraph.reflow",
        "frame_extract.video",
        "video_demux.split",
        "scene_detect.video",
        "speech_loop.transform"
      ]
    },
    {
      "id": "memory",
      "label": "Aurekai Memory",
      "description": "Model pulling/routing, FPQ compression, FPQx alignment, SAE activation, vector search, KV cache chain, and quantisation roundtrip.",
      "commands": [
        "model.pull",
        "model.route",
        "model.verify",
        "fpq.compress",
        "fpq.roundtrip",
        "fpqx.align",
        "fpqx.eval",
        "quant.roundtrip",
        "sli.auto_run",
        "layer.compat",
        "embed.text",
        "vec.search",
        "sae.activate",
        "sae.gate",
        "kvcache.chain"
      ]
    },
    {
      "id": "proof",
      "label": "Aurekai Proof",
      "description": "Canonical hashing, diffing, Merkle graph, lineage, equivalence indexing, proof bundle assembly, and continuity fail-vector validation.",
      "commands": [
        "canon.parse",
        "canon.hash",
        "canon.diff",
        "hash.file",
        "hash.merkle",
        "graph.lineage",
        "graph.merkle",
        "graph.validate",
        "index.equivalence",
        "entity.resolve",
        "query.sql",
        "proof.bundle",
        "proof.export",
        "family.group",
        "continuity.validate_fail_vectors"
      ]
    },
    {
      "id": "reason",
      "label": "Aurekai Reason",
      "description": "Reasoning sessions, branching, diff, rebase, physics trajectories, flow branching, and learning feedback.",
      "commands": [
        "reason.start",
        "reason.branch",
        "reason.run",
        "reason.diff",
        "reason.rebase",
        "physics.init",
        "physics.kick",
        "physics.run",
        "physics.diff",
        "flow.branch",
        "learn.feedback",
        "learn.tune"
      ]
    },
    {
      "id": "wire",
      "label": "Aurekai Wire",
      "description": "Telephony simulation, PCAP ingest, wire probing/reporting, MoQ video relay, and network seal/eval.",
      "commands": [
        "tel.listen",
        "tel.mock",
        "tel.sim_call",
        "tel.sim_sms",
        "tel.send_sms",
        "wire.doctor",
        "wire.ingest_pcap",
        "wire.probe",
        "wire.report",
        "wire.recipe",
        "wire.space_export",
        "moq.video_relay",
        "net.seal",
        "net.eval_sealed"
      ]
    },
    {
      "id": "publish",
      "label": "Aurekai Publish",
      "description": "Brief generation, publish-chain orchestration, narration, document rendering, deliverable packing, artifact emission, distribution, clip extraction, content repurposing, and surface publishing.",
      "commands": [
        "brief.generate",
        "publish.chain",
        "narrate.brief",
        "render.document",
        "pack.deliverable",
        "emit.artifact",
        "distribute.bundle",
        "clips.extract",
        "repurpose.content",
        "surface.publish"
      ]
    },
    {
      "id": "substrate",
      "label": "Aurekai Substrate",
      "description": "Capability registry inspection, space management, time scheduling, family compression, KV cache ancestry, and hardening tests.",
      "commands": [
        "context.plan",
        "context.kv_registry",
        "capability.registry",
        "space.open",
        "space.put",
        "space.attach",
        "time.schedule",
        "time.rerun",
        "compress.family",
        "kvcache.ancestry",
        "netlist.seal",
        "netlist.eval_sealed",
        "violence.coupling_test"
      ]
    }
  ],
  "experimental_tracks": [
    {
      "id": "integrity",
      "label": "Aurekai Integrity",
      "description": "CI coupling tests and weekly stress proofs via AkaiViolence.",
      "commands": ["violence.coupling_test"]
    },
    {
      "id": "sealed_compute",
      "label": "Aurekai Sealed Compute",
      "description": "AkaiNet sealed netlists for tamper-evident, third-party-verifiable computation.",
      "commands": ["netlist.seal", "netlist.eval_sealed"]
    },
    {
      "id": "model_capability_qa",
      "label": "Aurekai Model Capability QA",
      "description": "AkaiFlashQLA post-FPQ attention capability verification.",
      "commands": ["fpq.roundtrip", "fpqx.eval", "sli.auto_run"]
    },
    {
      "id": "liveops",
      "label": "Aurekai LiveOps",
      "description": "AkaiMoQ real-time collaborative proof and pipeline event stream.",
      "commands": ["moq.video_relay", "wire.probe", "wire.report"]
    }
  ],
  "packs": {
    "A": {
      "label": "Release / Proof Baseline",
      "commands": ["doctor.deep", "manifest.verify", "model.verify", "sae.activate", "vec.search", "proof.bundle", "proof.export", "release.gate"]
    },
    "B": {
      "label": "Runtime / Control",
      "commands": ["runtime.capabilities", "api.status", "control.route", "queue.enqueue", "queue.stats", "queue.work", "tier.route", "workflow.run", "stitch.plan", "watch.path"]
    },
    "C": {
      "label": "Commerce / Business Ops",
      "commands": ["auth.verify", "gate.issue", "gate.guard", "meter.record", "usage.report", "ledger.export", "invoice.generate", "finance.margin", "project.create", "outreach.followup", "cms.entry.create"]
    },
    "D": {
      "label": "Intake / Media / Publish",
      "commands": ["intake.resolve", "ingest.file", "media_prep.normalize", "transcribe.audio", "transcript.clean", "segment.speakers", "paragraph.reflow", "frame_extract.video", "scene_detect.video", "brief.generate", "publish.chain", "narrate.brief", "pack.deliverable", "clips.extract", "repurpose.content", "distribute.bundle"]
    },
    "E": {
      "label": "Memory / Model Intelligence",
      "commands": ["model.pull", "model.route", "model.verify", "fpq.compress", "fpq.roundtrip", "fpqx.align", "fpqx.eval", "quant.roundtrip", "sli.auto_run", "layer.compat", "embed.text", "vec.search", "sae.activate", "sae.gate", "kvcache.chain"]
    },
    "F": {
      "label": "Proof / Graph / Equivalence",
      "commands": ["canon.parse", "canon.hash", "canon.diff", "hash.file", "hash.merkle", "graph.lineage", "graph.merkle", "graph.validate", "index.equivalence", "entity.resolve", "query.sql", "proof.bundle", "family.group", "continuity.validate_fail_vectors"]
    },
    "G": {
      "label": "Reason / Physics / Learning",
      "commands": ["reason.start", "reason.branch", "reason.run", "reason.diff", "reason.rebase", "physics.init", "physics.kick", "physics.run", "physics.diff", "flow.branch", "learn.feedback", "learn.tune"]
    },
    "H": {
      "label": "Wire / Telephony / Events",
      "commands": ["tel.listen", "tel.mock", "tel.sim_call", "tel.sim_sms", "tel.send_sms", "wire.doctor", "wire.ingest_pcap", "wire.probe", "wire.report", "wire.recipe", "wire.space_export", "moq.video_relay", "net.seal", "net.eval_sealed"]
    },
    "I": {
      "label": "Substrate / Hardening",
      "commands": ["context.plan", "context.kv_registry", "capability.registry", "space.open", "space.put", "space.attach", "time.schedule", "time.rerun", "compress.family", "kvcache.ancestry", "netlist.seal", "netlist.eval_sealed", "violence.coupling_test"]
    }
  },
  "generated_artifacts": [
    "aurekai-run.json",
    "aurekai-proof.akproof.json",
    "aurekai-feature-report.json",
    "aurekai-lineage.json",
    "aurekai-metering.json",
    "aurekai-invoice.json",
    "aurekai-wire-report.json",
    "aurekai-brief.json",
    "aurekai-model-pack.akmodel",
    "aurekai-sae-dict.aksae",
    "aurekai-fpqx-align.akfpqx"
  ]
}
